{
  "schemaVersion": 1,
  "snapshotId": "snapshot-0.3.0-dev-82a94580d4f8",
  "catalogVersion": "0.3.0-dev",
  "policyId": "corpus-policy-phase4-smoke",
  "policyVersion": "1.0.0",
  "recipeCount": 3,
  "activeRecipeCount": 3,
  "coverageCells": [
    {
      "targetId": "smoke-lunch",
      "currentCount": 3,
      "denominator": 3,
      "currentShare": 1,
      "normalizedDeficit": 0.625,
      "weightedDeficit": 0.625
    },
    {
      "targetId": "smoke-dinner",
      "currentCount": 3,
      "denominator": 3,
      "currentShare": 1,
      "normalizedDeficit": 0.625,
      "weightedDeficit": 0.625
    },
    {
      "targetId": "smoke-portable",
      "currentCount": 2,
      "denominator": 3,
      "currentShare": 0.6667,
      "normalizedDeficit": 0.6667,
      "weightedDeficit": 0.5333
    }
  ],
  "distributions": {
    "mealArchetypes": [
      {
        "key": "dinner",
        "count": 3
      },
      {
        "key": "lunch",
        "count": 3
      }
    ],
    "energyBands": [
      {
        "key": "kcal-200-399",
        "count": 1
      },
      {
        "key": "kcal-400-599",
        "count": 2
      }
    ],
    "proteinBands": [
      {
        "key": "protein-high",
        "count": 1
      },
      {
        "key": "protein-low",
        "count": 1
      },
      {
        "key": "protein-medium",
        "count": 1
      }
    ],
    "fiberBands": [
      {
        "key": "fiber-low",
        "count": 3
      }
    ],
    "practicality": [
      {
        "key": "practical_cold_suitable",
        "count": 2
      },
      {
        "key": "practical_meal_prep",
        "count": 3
      },
      {
        "key": "practical_portable",
        "count": 2
      },
      {
        "key": "practical_quick",
        "count": 1
      }
    ],
    "diet": [
      {
        "key": "diet_high_protein",
        "count": 2
      },
      {
        "key": "diet_vegetarian",
        "count": 1
      }
    ],
    "recipeFamilies": [
      {
        "key": "recipe_family_grain_bowl",
        "count": 2
      },
      {
        "key": "recipe_family_protein_plate",
        "count": 1
      }
    ],
    "cuisines": [
      {
        "key": "cuisine_mediterranean",
        "count": 3
      }
    ],
    "ingredientCategories": [
      {
        "key": "food_group_fats_oils",
        "count": 3
      },
      {
        "key": "food_group_fish_seafood",
        "count": 2
      },
      {
        "key": "food_group_pasta_rice_cereals",
        "count": 2
      },
      {
        "key": "food_group_vegetables",
        "count": 3
      }
    ]
  },
  "ingredientUsage": [
    {
      "ingredientId": "ing_olive_oil",
      "recipeCount": 3,
      "primaryCount": 0,
      "recipeShare": 1,
      "primaryShare": 0
    },
    {
      "ingredientId": "ing_rice_cooked",
      "recipeCount": 2,
      "primaryCount": 1,
      "recipeShare": 0.6667,
      "primaryShare": 0.3333
    },
    {
      "ingredientId": "ing_salmon",
      "recipeCount": 2,
      "primaryCount": 0,
      "recipeShare": 0.6667,
      "primaryShare": 0
    },
    {
      "ingredientId": "ing_zucchini",
      "recipeCount": 3,
      "primaryCount": 2,
      "recipeShare": 1,
      "primaryShare": 0.6667
    }
  ],
  "ingredientPairUsage": [
    {
      "ingredientIdA": "ing_olive_oil",
      "ingredientIdB": "ing_zucchini",
      "coOccurrenceCount": 3,
      "share": 1
    },
    {
      "ingredientIdA": "ing_olive_oil",
      "ingredientIdB": "ing_rice_cooked",
      "coOccurrenceCount": 2,
      "share": 0.6667
    },
    {
      "ingredientIdA": "ing_olive_oil",
      "ingredientIdB": "ing_salmon",
      "coOccurrenceCount": 2,
      "share": 0.6667
    },
    {
      "ingredientIdA": "ing_rice_cooked",
      "ingredientIdB": "ing_zucchini",
      "coOccurrenceCount": 2,
      "share": 0.6667
    },
    {
      "ingredientIdA": "ing_salmon",
      "ingredientIdB": "ing_zucchini",
      "coOccurrenceCount": 2,
      "share": 0.6667
    },
    {
      "ingredientIdA": "ing_rice_cooked",
      "ingredientIdB": "ing_salmon",
      "coOccurrenceCount": 1,
      "share": 0.3333
    }
  ],
  "similarity": {
    "exactDuplicateCount": 0,
    "nearDuplicateCount": 0,
    "nearDuplicateShare": 0
  },
  "quality": {
    "schemaErrors": 0,
    "unknownIngredientReferences": 0,
    "nutritionErrors": 3,
    "allergenDerivationErrors": 0,
    "missingRequiredLocaleFields": 0
  },
  "undercoveredTargetIds": [
    "smoke-lunch",
    "smoke-dinner",
    "smoke-portable"
  ],
  "contentDigest": "sha256:82a94580d4f89d7ef4f5da8a971a21f162b10cdef9b6b27a00b6a59fea9b8242",
  "createdAt": "2026-09-03T14:05:00Z"
}
